{
    "Class": "Babylon",
    "Type": "Super Battleship",
    "Points": 325,
    "Tonnage": "H",
    "BaseSize": 50,
    "Profile": {
        "Thrust": 6,
        "Scan": 10,
        "Sig": 10,
        "Hull": 20,
        "ES": "4+",
        "KS": "3+",
        "BS": "5+",
        "G": "1",
        "Special": []
    },
    "Weapons": [
        {
            "Name": "Python Super Heavy Laser",
            "Arc": "FN",
            "Att": 5,
            "Lock": "3+",
            "DMG": 2,
            "Type": "E",
            "Special": [
                "Bloom-2",
                "Burnthrough-2",
                "Flash-1",
                "Focused"
            ]
        },
        {
            "Name": "UF-6400 Mass Driver Turret Triad",
            "Arc": "F/S",
            "Att": 6,
            "Lock": "3+",
            "DMG": 1,
            "Type": "K",
            "Special": [
                "Critical-1"
            ]
        },
        {
            "Name": "UF-4200 Mass Driver Turrets",
            "Arc": "F/S",
            "Att": 4,
            "Lock": "4+",
            "DMG": 1,
            "Type": "K",
            "Special": [
                "Fusillade-2"
            ]
        },
        {
            "Name": "UF-4200 Mass Driver Turrets",
            "Arc": "F/S",
            "Att": 4,
            "Lock": "4+",
            "DMG": 1,
            "Type": "K",
            "Special": [
                "Fusillade-2"
            ]
        },
        {
            "Name": "Cobra Heavy Laser Pair",
            "Arc": "FN",
            "Att": 6,
            "Lock": "3+",
            "DMG": 1,
            "Type": "E",
            "Special": [
                "Burnthrough-2",
                "Flash-2",
                "Focused"
            ],
            "Cost": 5,
            "Replaces": [
                "UF-4200 Mass Driver Turrets",
                "UF-4200 Mass Driver Turrets"
            ],
            "RuleName": "Laser Refit"
        }
    ],
    "Load": [
        {
            "Load": "Fighters & Bombers",
            "Launch": 4,
            "Special": [
                "Alt-1"
            ]
        },
        {
            "Load": "Heavy Bombers",
            "Launch": 3,
            "Special": [
                "Alt-1"
            ]
        },
        {
            "Load": "Medium Torpedo",
            "Launch": 1,
            "Special": [
                "Limited-2"
            ]
        }
    ],
    "Rules": [
        {
            "Name": "Laser Refit",
            "Text": "This Ship may take a Laser Refit for +5 points, replacing both of its UF-4200 Mass Driver Turrets with a single Cobra Heavy Laser Pair."
        }
    ],
    "KnownShips": [
        "Babylon",
        "Alexander the Great",
        "Gaugamela",
        "Nebuchadnezzar"
    ],
    "Flavour": "The Babylon shares the substantial armaments and fleet carrier capacity as its sister class, the Byzantium super battleship, but the Babylon elevates its anti-shipping capabilities by replacing the bombardment turrets with UF-6400 mass driver turrets. This was only possible due to the UCM's latest battleship superstructure and its enhanced power generators. Together, its extensive weapons suite is enough to obliterate any foe."
}