{
    "Class": "Beelzebub",
    "Type": "Battleship",
    "Points": 255,
    "Tonnage": "H",
    "BaseSize": 50,
    "Profile": {
        "Thrust": 8,
        "Scan": 8,
        "Sig": 10,
        "Hull": 20,
        "ES": "3+",
        "KS": "4+",
        "BS": "5+",
        "G": "1",
        "Special": []
    },
    "Weapons": [
        {
            "Name": "Mega Plasma Lance Battery",
            "Arc": "F/S",
            "Att": 3,
            "Lock": "3+",
            "DMG": 2,
            "Type": "E",
            "Special": [
                "Calibre-H/C",
                "Reave-2",
                "Volley-2"
            ]
        },
        {
            "Name": "Oculus Beam Array",
            "Arc": "F/S",
            "Att": 3,
            "Lock": "3+",
            "DMG": 2,
            "Type": "E",
            "Special": [
                "Scald-1"
            ]
        },
        {
            "Name": "Furnace Fangs",
            "Arc": "FN",
            "Att": 6,
            "Lock": "2+",
            "DMG": 1,
            "Type": "E",
            "Special": [
                "Burnthrough-1",
                "Crippling-Fire",
                "Focused"
            ]
        }
    ],
    "Load": [
        {
            "Load": "Fighters & Bombers",
            "Launch": 3,
            "Special": []
        }
    ],
    "Rules": [
        {
            "Name": "Keel Refit",
            "Text": "This Ship may take a Cloaking Keel for +15 points, gaining Stealth and Cloak-2, or an Engine Upgrade for +25 points increasing Thrust by 3\"."
        }
    ],
    "Upgrades": [
        {
            "Name": "Keel Refit",
            "Min": 0,
            "Max": 1,
            "Options": [
                {
                    "Name": "Cloaking Keel",
                    "Cost": 15,
                    "Effects": [
                        {
                            "Target": "Special",
                            "Type": "append",
                            "Value": "Stealth"
                        },
                        {
                            "Target": "Special",
                            "Type": "append",
                            "Value": "Cloak-2"
                        }
                    ]
                },
                {
                    "Name": "Engine Upgrade",
                    "Cost": 25,
                    "Effects": [
                        {
                            "Target": "Thrust",
                            "Type": "add",
                            "Value": 3
                        }
                    ]
                }
            ]
        }
    ],
    "KnownShips": [],
    "Flavour": ""
}