{
    "Class": "Sierra",
    "Type": "Pocket Battleship",
    "Points": 185,
    "Tonnage": "H",
    "BaseSize": 50,
    "Profile": {
        "Thrust": 8,
        "Scan": 10,
        "Sig": 4,
        "Hull": 14,
        "ES": "4+",
        "KS": "4+",
        "BS": "5+",
        "G": "1",
        "Special": []
    },
    "Weapons": [
        {
            "Name": "Hyper Lightvice",
            "Arc": "F/S",
            "Att": 5,
            "Lock": "2+",
            "DMG": 3,
            "Type": "K",
            "Special": [
                "Bloom-1",
                "Close Action",
                "Focused",
                "Scald-1"
            ]
        },
        {
            "Name": "Decon Blaster",
            "Arc": "FN",
            "Att": 3,
            "Lock": "3+",
            "DMG": 1,
            "Type": "E",
            "Special": []
        },
        {
            "Name": "Decon Blaster",
            "Arc": "FN",
            "Att": 3,
            "Lock": "3+",
            "DMG": 1,
            "Type": "E",
            "Special": []
        }
    ],
    "Load": [],
    "Rules": [
        {
            "Name": "Feature Carrier",
            "Text": "At the start of the game, before players deploy, choose from the Gravitational Arc or Ghost Orb Tower Deployable Feature. This Ship starts the game carrying the chosen Deployable Feature."
        }
    ],
    "KnownShips": [],
    "Flavour": ""
}