{
    "Class": "Seattle",
    "Type": "Fleet Carrier",
    "Points": 116,
    "Tonnage": "M",
    "BaseSize": 40,
    "Profile": {
        "Thrust": 8,
        "Scan": 6,
        "Sig": 6,
        "Hull": 10,
        "ES": "4+",
        "KS": "3+",
        "BS": "-",
        "G": "1",
        "Special": []
    },
    "Weapons": [
        {
            "Name": "UF-6400 Mass Driver Turrets",
            "Arc": "F/S",
            "Att": 4,
            "Lock": "3+",
            "DMG": 1,
            "Type": "K",
            "Special": [
                "Critical-1"
            ]
        }
    ],
    "Load": [
        {
            "Load": "Fighters & Bombers",
            "Launch": 2,
            "Special": []
        },
        {
            "Load": "Mines",
            "Launch": 2,
            "Special": [],
            "Cost": 10,
            "Replaces": [
                "Fighters & Bombers"
            ],
            "RuleName": "Minelayer"
        }
    ],
    "Rules": [
        {
            "Name": "Minelayer",
            "Text": "This ship may replace its Fighters & Bombers with Mines for +10 pts."
        }
    ],
    "KnownShips": [
        "Ark Royal",
        "Midway",
        "Enterprise",
        "Waning Tide"
    ],
    "Flavour": "The Seattle class is multi-role cruiser tonnage carrier for void-capable fighters and bombers. Its capacious hangars accommodate a large number of these nimble strike craft while the ship itself is armed with four UF-6400 mass drivers in a pair of turrets for direct ship-ship engagements. These characteristics make the Seattle a flexible and valuable asset in almost any engagement despite its lower launch capacity compared to some of the more dedicated carriers of other races.\nAs a fleet carrier, the Seattle is often positioned towards the rear of the battle, where its strike craft can support the main formation while it stays clear of the engagement. However, since it sports reasonable anti-ship firepower and launch assets have low power requirements, it is possible for the Seattle to use both while conducting advanced manoeuvres. This makes the Seattle a potent tool in the hands of a skilled captain whose carefully directed aggression and quick thinking are rewarded with disproportionate damage to the enemy."
}