{
    "Class": "Faust",
    "Type": "Super Battleship",
    "Points": 265,
    "Tonnage": "H",
    "BaseSize": 50,
    "Profile": {
        "Thrust": 6,
        "Scan": 8,
        "Sig": 10,
        "Hull": 20,
        "ES": "3+",
        "KS": "4+",
        "BS": "5+",
        "G": "1",
        "Special": []
    },
    "Weapons": [
        {
            "Name": "Heavy Plasma Beam Pair",
            "Arc": "F",
            "Att": 3,
            "Lock": "3+",
            "DMG": 2,
            "Type": "E",
            "Special": [
                "Close Action",
                "Penetrator"
            ]
        },
        {
            "Name": "Oculus Beam Array",
            "Arc": "F/S",
            "Att": 3,
            "Lock": "3+",
            "DMG": 2,
            "Type": "E",
            "Special": [
                "Scald-1"
            ]
        }
    ],
    "Load": [
        {
            "Load": "Fighters & Bombers",
            "Launch": 5,
            "Special": []
        },
        {
            "Load": "Torpedo",
            "Launch": 2,
            "Special": [
                "Limited-2"
            ]
        }
    ],
    "Rules": [
        {
            "Name": "Keel Options",
            "Text": "This Ship must take either a Cloaking Keel, gaining Stealth and Cloak-2, or an Engine Upgrade for +10 points, increasing Thrust by 3\"."
        }
    ],
    "Upgrades": [
        {
            "Name": "Keel Options",
            "Min": 1,
            "Max": 1,
            "Options": [
                {
                    "Name": "Cloaking Keel",
                    "Cost": 0,
                    "Effects": [
                        {
                            "Target": "Special",
                            "Type": "append",
                            "Value": "Stealth"
                        },
                        {
                            "Target": "Special",
                            "Type": "append",
                            "Value": "Cloak-2"
                        }
                    ]
                },
                {
                    "Name": "Engine Upgrade",
                    "Cost": 10,
                    "Effects": [
                        {
                            "Target": "Thrust",
                            "Type": "add",
                            "Value": 3
                        }
                    ]
                }
            ]
        }
    ],
    "KnownShips": [
        "Dark Pact",
        "Mephistopheles",
        "Descent",
        "Cloud over Shangri-la"
    ],
    "Flavour": "The Faust class super battleship is a lethally flexible ship, although it generally favours killing at close range where it can employ its twin heavy plasma beams. The Faust also boasts significant launch capabilities to strike at more distant targets, aided by its deadly torpedo payload. Oculus weapons round off this leviathan's murderous capabilities."
}