{
    "Class": "Thebes",
    "Type": "Super Battleship",
    "Points": 310,
    "Tonnage": "H",
    "BaseSize": 50,
    "Profile": {
        "Thrust": 6,
        "Scan": 10,
        "Sig": 10,
        "Hull": 20,
        "ES": "4+",
        "KS": "3+",
        "BS": "5+",
        "G": "1",
        "Special": [
            "Marines-2"
        ]
    },
    "Weapons": [
        {
            "Name": "UF-12000 Twin Mass Driver",
            "Arc": "FN",
            "Att": 2,
            "Lock": "2+",
            "DMG": 4,
            "Type": "C",
            "Special": [
                "Crippling"
            ]
        },
        {
            "Name": "UF-6400 Mass Driver Turrets",
            "Arc": "F/S",
            "Att": 4,
            "Lock": "3+",
            "DMG": 1,
            "Type": "K",
            "Special": [
                "Critical-1"
            ]
        },
        {
            "Name": "UF-4200 Mass Driver Turrets",
            "Arc": "F/S",
            "Att": 4,
            "Lock": "4+",
            "DMG": 1,
            "Type": "K",
            "Special": [
                "Fusillade-2"
            ]
        },
        {
            "Name": "UF-4200 Mass Driver Turrets",
            "Arc": "F/S",
            "Att": 4,
            "Lock": "4+",
            "DMG": 1,
            "Type": "K",
            "Special": [
                "Fusillade-2"
            ]
        },
        {
            "Name": "Cobra Heavy Laser Pair",
            "Arc": "FN",
            "Att": 6,
            "Lock": "3+",
            "DMG": 1,
            "Type": "E",
            "Special": [
                "Burnthrough-2",
                "Flash-2",
                "Focused"
            ],
            "Cost": 5,
            "Replaces": [
                "UF-4200 Mass Driver Turrets",
                "UF-4200 Mass Driver Turrets"
            ],
            "RuleName": "Laser Refit"
        }
    ],
    "Load": [
        {
            "Load": "Bulk Landers",
            "Launch": 8,
            "Special": []
        },
        {
            "Load": "Drop Pods",
            "Launch": 2,
            "Special": [
                "Alt-1"
            ]
        },
        {
            "Load": "Boarding Pods",
            "Launch": 2,
            "Special": [
                "Alt-1"
            ]
        }
    ],
    "Rules": [
        {
            "Name": "Laser Refit",
            "Text": "This Ship may take a Laser Refit for +5 points, replacing both of its UF-4200 Mass Driver Turrets with a single Cobra Heavy Laser Pair."
        }
    ],
    "KnownShips": [
        "Thebes",
        "Cadmus",
        "Cassander",
        "Ark Majesty"
    ],
    "Flavour": "The Thebes is the latest super battleship class to enter service with the UCMF. The Naval Design Bureau began with the Carthage's superstructure and weapons payload but reconfigured its cavernous launch bay forecastle for surface deployments in addition to mounting a pair of UF-6400 turrets. From here the Thebes can launch bulk landers, drop pods, and boarding torpedoes. Already, the class has earned a reputation as a golden deployment for landing troops since they're unlikely to perish aboard ship before making planetfall."
}