{
    "Class": "New York",
    "Type": "Battleship",
    "Points": 245,
    "Tonnage": "H",
    "BaseSize": 50,
    "Profile": {
        "Thrust": 6,
        "Scan": 10,
        "Sig": 10,
        "Hull": 20,
        "ES": "4+",
        "KS": "3+",
        "BS": "5+",
        "G": "1",
        "Special": []
    },
    "Weapons": [
        {
            "Name": "UF-4200 Mass Driver Turrets",
            "Arc": "F/S",
            "Att": 4,
            "Lock": "4+",
            "DMG": 1,
            "Type": "K",
            "Special": [
                "Fusillade-2"
            ]
        },
        {
            "Name": "UF-4200 Mass Driver Turrets",
            "Arc": "F/S",
            "Att": 4,
            "Lock": "4+",
            "DMG": 1,
            "Type": "K",
            "Special": [
                "Fusillade-2"
            ]
        },
        {
            "Name": "Cobra Heavy Laser Pair",
            "Arc": "FN",
            "Att": 6,
            "Lock": "3+",
            "DMG": 1,
            "Type": "E",
            "Special": [
                "Burnthrough-2",
                "Flash-2",
                "Focused"
            ],
            "Cost": 5,
            "Replaces": [
                "UF-4200 Mass Driver Turrets",
                "UF-4200 Mass Driver Turrets"
            ],
            "RuleName": "Laser Refit"
        }
    ],
    "Load": [
        {
            "Load": "Medium Torpedo",
            "Launch": 1,
            "Special": [
                "Limited-2"
            ]
        },
        {
            "Load": "Fighters & Bombers",
            "Launch": 4,
            "Special": []
        }
    ],
    "Rules": [
        {
            "Name": "Drive Refit",
            "Text": "This Ship may take a Drive Refit for +45 points, increasing its Thrust by 3\"."
        },
        {
            "Name": "Laser Refit",
            "Text": "This Ship may take a Laser Refit for +5 points, replacing both of its UF-4200 Mass Driver Turrets with a single Cobra Heavy Laser Pair."
        }
    ],
    "Upgrades": [
        {
            "Name": "Drive Refit",
            "Cost": 45,
            "Effects": [
                {
                    "Target": "Thrust",
                    "Type": "add",
                    "Value": 3
                }
            ]
        }
    ],
    "KnownShips": [],
    "Flavour": ""
}