{
    "Class": "Sluice",
    "Type": "Supercruiser",
    "Points": 152,
    "Tonnage": "M",
    "BaseSize": 50,
    "Profile": {
        "Thrust": 7,
        "Scan": 10,
        "Sig": 4,
        "Hull": 11,
        "ES": "4+",
        "KS": "4+",
        "BS": "5+",
        "G": "1",
        "Special": []
    },
    "Weapons": [
        {
            "Name": "Hyper Lightvice",
            "Arc": "F/S",
            "Att": 5,
            "Lock": "2+",
            "DMG": 3,
            "Type": "K",
            "Special": [
                "Bloom-1",
                "Close Action",
                "Focused",
                "Scald-1"
            ]
        }
    ],
    "Load": [
        {
            "Load": "Torpedo",
            "Launch": 2,
            "Special": [
                "Limited-4"
            ]
        }
    ],
    "Rules": [
        {
            "Name": "Feature Carrier",
            "Text": "At the start of the game, before players deploy, choose from the Gravitational Arc or Ghost Orb Tower Deployable Feature. This Ship starts the game carrying the chosen Deployable Feature."
        }
    ],
    "KnownShips": [],
    "Flavour": ""
}