{
    "Class": "Samael",
    "Type": "Super Battleship",
    "Points": 285,
    "Tonnage": "H",
    "BaseSize": 50,
    "Profile": {
        "Thrust": 6,
        "Scan": 8,
        "Sig": 10,
        "Hull": 20,
        "ES": "3+",
        "KS": "4+",
        "BS": "5+",
        "G": "1",
        "Special": []
    },
    "Weapons": [
        {
            "Name": "Mega Plasma Lance Battery",
            "Arc": "F/S",
            "Att": 3,
            "Lock": "3+",
            "DMG": 2,
            "Type": "E",
            "Special": [
                "Calibre-H/C",
                "Reave-2",
                "Volley-2"
            ]
        },
        {
            "Name": "Oculus Beam Phalanx",
            "Arc": "F/S",
            "Att": 4,
            "Lock": "3+",
            "DMG": 2,
            "Type": "E",
            "Special": [
                "Scald-1",
                "Volley-2"
            ]
        },
        {
            "Name": "Furnace Fangs",
            "Arc": "FN",
            "Att": 6,
            "Lock": "2+",
            "DMG": 1,
            "Type": "E",
            "Special": [
                "Burnthrough-1",
                "Crippling-Fire",
                "Focused"
            ]
        },
        {
            "Name": "Oculus Beam Array",
            "Arc": "F/S",
            "Att": 3,
            "Lock": "3+",
            "DMG": 2,
            "Type": "E",
            "Special": [
                "Scald-1"
            ]
        }
    ],
    "Load": [
        {
            "Load": "Torpedo",
            "Launch": 2,
            "Special": [
                "Limited-2"
            ]
        }
    ],
    "Rules": [
        {
            "Name": "Keel Options",
            "Text": "This Ship must take either a Cloaking Keel, gaining Stealth and Cloak-2, or an Engine Upgrade for +10 points, increasing Thrust by 3\"."
        }
    ],
    "Upgrades": [
        {
            "Name": "Keel Options",
            "Min": 1,
            "Max": 1,
            "Options": [
                {
                    "Name": "Cloaking Keel",
                    "Cost": 0,
                    "Effects": [
                        {
                            "Target": "Special",
                            "Type": "append",
                            "Value": "Stealth"
                        },
                        {
                            "Target": "Special",
                            "Type": "append",
                            "Value": "Cloak-2"
                        }
                    ]
                },
                {
                    "Name": "Engine Upgrade",
                    "Cost": 10,
                    "Effects": [
                        {
                            "Target": "Thrust",
                            "Type": "add",
                            "Value": 3
                        }
                    ]
                }
            ]
        }
    ],
    "KnownShips": [
        "Our Plague",
        "Primeval Serpent",
        "Severity",
        "Destroying Angel"
    ],
    "Flavour": "Likely a close relation to its cousin, the Bael class, the Samael also mounts a mega plasma lance battery, multiple oculus weapons systems, and torpedoes. It forgoes the Bael's launch capacity though, in favour of even more direct anti-shipping firepower in the form of a pair of furnace fangs. This wide suite of weapons allows this super battleship to destroy multiple foes simultaneously or pummel one victim with extreme prejudice."
}