{
    "Class": "Carthage",
    "Type": "Super Battleship",
    "Points": 320,
    "Tonnage": "H",
    "BaseSize": 50,
    "Profile": {
        "Thrust": 6,
        "Scan": 10,
        "Sig": 10,
        "Hull": 20,
        "ES": "4+",
        "KS": "3+",
        "BS": "5+",
        "G": "1",
        "Special": []
    },
    "Weapons": [
        {
            "Name": "UF-12000 Twin Mass Driver",
            "Arc": "FN",
            "Att": 2,
            "Lock": "2+",
            "DMG": 4,
            "Type": "C",
            "Special": [
                "Crippling"
            ]
        },
        {
            "Name": "UF-4200 Mass Driver Turrets",
            "Arc": "F/S",
            "Att": 4,
            "Lock": "4+",
            "DMG": 1,
            "Type": "K",
            "Special": [
                "Fusillade-2"
            ]
        },
        {
            "Name": "UF-4200 Mass Driver Turrets",
            "Arc": "F/S",
            "Att": 4,
            "Lock": "4+",
            "DMG": 1,
            "Type": "K",
            "Special": [
                "Fusillade-2"
            ]
        },
        {
            "Name": "Cobra Heavy Laser Pair",
            "Arc": "FN",
            "Att": 6,
            "Lock": "3+",
            "DMG": 1,
            "Type": "E",
            "Special": [
                "Burnthrough-2",
                "Flash-2",
                "Focused"
            ],
            "Cost": 5,
            "Replaces": [
                "UF-4200 Mass Driver Turrets",
                "UF-4200 Mass Driver Turrets"
            ],
            "RuleName": "Laser Refit"
        }
    ],
    "Load": [
        {
            "Load": "Fighters & Bombers",
            "Launch": 4,
            "Special": [
                "Alt-1"
            ]
        },
        {
            "Load": "Heavy Bombers",
            "Launch": 3,
            "Special": [
                "Alt-1"
            ]
        },
        {
            "Load": "Medium Torpedo",
            "Launch": 1,
            "Special": [
                "Limited-2"
            ]
        }
    ],
    "Rules": [
        {
            "Name": "Laser Refit",
            "Text": "This Ship may take a Laser Refit for +5 points, replacing both of its UF-4200 Mass Driver Turrets with a single Cobra Heavy Laser Pair."
        }
    ],
    "KnownShips": [
        "Hannibal",
        "War Elephant",
        "Phoenician",
        "Scipio Africanus"
    ],
    "Flavour": "Much like its sister class, the Babylon, the Carthage is configured for the annihilation of enemy ships. The Carthage focuses almost entirely on kinetic damage though, built around a pair of colossal UF-12000 mass drivers in a fixed frontal mounting. It maintains its sister's fleet carrier capacity for enhanced strategic might. Should energy weapons be required, its UF-4200 turrets may be upgraded to a pair of Cobra heavy lasers—an option it shares with other UCM battleships."
}